{
  "$schema": "https://json-schema.org/draft/2020-12/schema",
  "additionalProperties": false,
  "description": "GENERATED by `lake exe emitmeta` — do not edit. The debt projection: every docstring obligation still owed, parked or pin-pending, and every unbound ruling. The artifact is committed at library/cas/surface/cas-debts.json; this schema is the Lean declaration of its shape (tools/MetaShapes.lean) and regeneration is byte-identity-gated.",
  "emitted": {
    "emitter": "emitmeta",
    "module": "library/cas/tools/MetaShapes.lean",
    "schemaVersion": 1,
    "toolchain": "4.33.1"
  },
  "properties": {
    "convention": {
      "type": "string"
    },
    "counters": {
      "additionalProperties": false,
      "properties": {
        "debts": {
          "minimum": 0,
          "type": "integer"
        },
        "docstrings": {
          "minimum": 0,
          "type": "integer"
        },
        "named": {
          "minimum": 0,
          "type": "integer"
        },
        "owed": {
          "minimum": 0,
          "type": "integer"
        },
        "parked": {
          "minimum": 0,
          "type": "integer"
        },
        "pinPending": {
          "minimum": 0,
          "type": "integer"
        },
        "settled": {
          "minimum": 0,
          "type": "integer"
        },
        "unboundRulings": {
          "minimum": 0,
          "type": "integer"
        }
      },
      "required": ["debts", "docstrings", "owed", "parked", "pinPending", "named", "settled", "unboundRulings"],
      "type": "object"
    },
    "debts": {
      "items": {
        "additionalProperties": false,
        "properties": {
          "declaration": {
            "type": "string"
          },
          "excerpt": {
            "type": "string"
          },
          "file": {
            "type": "string"
          },
          "id": {
            "type": "string"
          },
          "keyword": {
            "type": "string"
          },
          "line": {
            "minimum": 0,
            "type": "integer"
          },
          "module": {
            "type": "string"
          },
          "settledBy": {
            "items": {
              "type": "string"
            },
            "type": "array"
          },
          "source": {
            "enum": ["docstring", "ruling"],
            "type": "string"
          },
          "state": {
            "enum": ["owed", "parked", "pin-pending", "unbound"],
            "type": "string"
          },
          "statement": {
            "type": "string"
          }
        },
        "required": ["source", "state"],
        "type": "object"
      },
      "type": "array"
    },
    "emitted": {
      "additionalProperties": false,
      "properties": {
        "emitter": {
          "type": "string"
        },
        "module": {
          "type": "string"
        },
        "schemaVersion": {
          "minimum": 0,
          "type": "integer"
        },
        "toolchain": {
          "type": "string"
        }
      },
      "required": ["schemaVersion", "emitter", "module", "toolchain"],
      "type": "object"
    },
    "library": {
      "type": "string"
    }
  },
  "required": ["emitted", "library", "convention", "counters", "debts"],
  "title": "cas-debts.json",
  "type": "object"
}
